date,budgetYear,description,amountUSD,srcOrganization,srcOrganizationTypes,srcLocations,srcUsageYearStart,srcUsageYearEnd,destPlan,destPlanCode,destPlanId,destOrganization,destOrganizationTypes,destGlobalClusters,destLocations,destProject,destProjectCode,destEmergency,destUsageYearStart,destUsageYearEnd,contributionType,flowType,method,boundary,onBoundary,status,firstReportedDate,decisionDate,keywords,originalAmount,originalCurrency,exchangeRate,id,refCode,createdAt,updatedAt
2025-07-29,2025,"UNRWA USA Zakat Funds for 2025 Gaza Flash Appeal
 Gaza",2528263,American National Committee for UNRWA,Private Organizations,,2025,2025,Escalation of Hostilities in the OPT Flash Appeal 2025,FPSE25,1273,United Nations Relief and Works Agency for Palestine Refugees in the Near East,Multilateral Organizations,Multipurpose Cash,PSE,,,oPt Complex Emergency 2023-24,2025,2025,financial,Standard,Cash transfer programming (CTP),incoming,single,paid,2025-07-29,2025-03-26,,,,,356048,PR25G20,2025-07-29,2025-07-29
2025-07-29,2025,"Caravanes Solidairres
Cash contribution to cover the transportation costs and/or the salaries of logistics and administrative personnel involved in the transportation of the in-kind donation
Food Security    Gaza",50000,,,,2025,2025,Escalation of Hostilities in the OPT Flash Appeal 2025,FPSE25,1273,United Nations Relief and Works Agency for Palestine Refugees in the Near East,Multilateral Organizations,Food Security,PSE,,,oPt Complex Emergency 2023-24,2025,2025,financial,Standard,Traditional aid,incoming,single,paid,2025-07-29,2025-03-13,,,,,356051,PR25G17,2025-07-29,2025-08-14
2025-07-29,2025,"Caravanes Solidairres
Cash contribution to cover the transportation costs and/or the salaries of logistics and administrative personnel involved in the transportation of the in-kind donation
Food Security    Gaza",379896,,,,2025,2025,Escalation of Hostilities in the OPT Flash Appeal 2025,FPSE25,1273,United Nations Relief and Works Agency for Palestine Refugees in the Near East,Multilateral Organizations,Food Security,PSE,,,oPt Complex Emergency 2023-24,2025,2025,financial,Standard,Traditional aid,incoming,single,commitment,2025-07-29,2025-03-13,,,,,356052,PR25G17,2025-07-29,2025-08-14
2025-07-29,2025,"for the food programme to purchase and distribute food commodities
Food Security    Gaza",25853,Private (individuals & organizations),Private Organizations,,2025,2025,Escalation of Hostilities in the OPT Flash Appeal 2025,FPSE25,1273,United Nations Relief and Works Agency for Palestine Refugees in the Near East,Multilateral Organizations,Food Security,PSE,,,oPt Complex Emergency 2023-24,2025,2025,financial,Standard,Traditional aid,incoming,single,paid,2025-07-29,2025-02-09,,,,,356053,PR25G10,2025-07-29,2025-08-14
2025-07-29,2025,"for protection programme to buy clothes for children in poverty
Protection         Gaza",25853,Private (individuals & organizations),Private Organizations,,2025,2025,Escalation of Hostilities in the OPT Flash Appeal 2025,FPSE25,1273,United Nations Relief and Works Agency for Palestine Refugees in the Near East,Multilateral Organizations,Protection,PSE,,,oPt Complex Emergency 2023-24,2025,2025,financial,Standard,Traditional aid,incoming,single,paid,2025-07-29,2025-02-09,,25000,EUR,0.967,356055,PR25G11,2025-07-29,2025-08-14
2025-07-29,2025,"for social services programme to buy devices to improve lives of people with disabilities
Emergency Health and Nutrition      Gaza",25853,Private (individuals & organizations),Private Organizations,,2025,2025,Escalation of Hostilities in the OPT Flash Appeal 2025,FPSE25,1273,United Nations Relief and Works Agency for Palestine Refugees in the Near East,Multilateral Organizations,Health,PSE,,,oPt Complex Emergency 2023-24,2025,2025,financial,Standard,Traditional aid,incoming,single,paid,2025-07-29,2025-02-09,,25000,EUR,0.967,356057,PR25G12,2025-07-29,2025-07-29
2025-07-29,2025,"UNRWA Staff Members
Gaza Flash Appeal 2025",13273,Private (individuals & organizations),Private Organizations,,2025,2025,Escalation of Hostilities in the OPT Flash Appeal 2025,FPSE25,1273,United Nations Relief and Works Agency for Palestine Refugees in the Near East,Multilateral Organizations,,PSE,,,oPt Complex Emergency 2023-24,2025,2025,financial,Standard,Traditional aid,incoming,single,paid,2025-07-29,2025-01-01,,,,,356060,PR25G25,2025-07-29,2025-07-29
2025-07-29,2025,"Private Partnership Funding
EA oPT flash appeal 2025
Food Security",2638286,Private (individuals & organizations),Private Organizations,,2025,2025,Escalation of Hostilities in the OPT Flash Appeal 2025,FPSE25,1273,United Nations Relief and Works Agency for Palestine Refugees in the Near East,Multilateral Organizations,Food Security,PSE,,,oPt Complex Emergency 2023-24,2025,2025,financial,Standard,Traditional aid,incoming,single,paid,2025-07-29,2025-01-01,,,,,356061,PR25G04,2025-07-29,2025-07-29
2025-07-29,2025,"Private Partnership Funding
EA oPT flash appeal 2025",601754,Private (individuals & organizations),Private Organizations,,2025,2025,Escalation of Hostilities in the OPT Flash Appeal 2025,FPSE25,1273,United Nations Relief and Works Agency for Palestine Refugees in the Near East,Multilateral Organizations,Food Security,PSE,,,oPt Complex Emergency 2023-24,2025,2025,financial,Standard,Traditional aid,incoming,single,paid,2025-07-29,2025-01-01,,,,,356062,PR25G04,2025-07-29,2025-07-29
2025-07-29,2025,"Zakat Fund: EA oPT flash appeal 2025- support to food and water
Emergency Multi-Purpose Cash Assistance",6784817,Private (individuals & organizations),Private Organizations,,2025,2025,Escalation of Hostilities in the OPT Flash Appeal 2025,FPSE25,1273,United Nations Relief and Works Agency for Palestine Refugees in the Near East,Multilateral Organizations,Multipurpose Cash,PSE,,,oPt Complex Emergency 2023-24,2025,2025,financial,Standard,Cash transfer programming (CTP),incoming,single,paid,2025-07-29,2025-01-01,,,,,356063,PR25G05,2025-07-29,2025-08-14
2025-07-29,2025,Zakat Fund: EA oPT flash appeal 2025- support to food and water,326820,Private (individuals & organizations),Private Organizations,,2025,2025,Escalation of Hostilities in the OPT Flash Appeal 2025,FPSE25,1273,United Nations Relief and Works Agency for Palestine Refugees in the Near East,Multilateral Organizations,,PSE,,,oPt Complex Emergency 2023-24,2025,2025,financial,Standard,Traditional aid,incoming,single,paid,2025-07-29,2025-01-01,,,,,356064,PR25G05,2025-07-29,2025-08-14
2025-07-29,2025,"Ramadan Emergency Cash Assistance for Vulnerable Families in the West Bank
Emergency Shelter and Non-Food Items",346049,Private (individuals & organizations),Private Organizations,,2025,2025,Escalation of Hostilities in the OPT Flash Appeal 2025,FPSE25,1273,United Nations Relief and Works Agency for Palestine Refugees in the Near East,Multilateral Organizations,Emergency Shelter and NFI,PSE,,,oPt Complex Emergency 2023-24,2025,2025,financial,Standard,Traditional aid,incoming,single,paid,2025-07-29,2025-02-28,,,,,356066,PR25G07,2025-07-29,2025-07-29
2025-07-29,2025,"Ramadan Emergency Cash Assistance for Vulnerable Families in the West Bank
Coordination, Management and Preparedness",209518,Private (individuals & organizations),Private Organizations,,2025,2025,Escalation of Hostilities in the OPT Flash Appeal 2025,FPSE25,1273,United Nations Relief and Works Agency for Palestine Refugees in the Near East,Multilateral Organizations,Coordination and support services,PSE,,,oPt Complex Emergency 2023-24,2025,2025,financial,Standard,Traditional aid,incoming,single,paid,2025-07-29,2025-02-28,,,,,356067,PR25G07,2025-07-29,2025-07-29
2025-07-29,2025,"Private Partnership Funding
Sadaqah Jariyah for long-term projects in Gaza
Emergency Multi-Purpose Cash Assistance",446,Private (individuals & organizations),Private Organizations,,2025,2025,Escalation of Hostilities in the OPT Flash Appeal 2025,FPSE25,1273,United Nations Relief and Works Agency for Palestine Refugees in the Near East,Multilateral Organizations,Multipurpose Cash,PSE,,,oPt Complex Emergency 2023-24,2025,2025,financial,Standard,Cash transfer programming (CTP),incoming,single,paid,2025-07-29,2025-05-29,,,,,356068,PR25G29,2025-07-29,2025-07-29
2025-07-29,,Gaza Health Emergency Project,208594,"Czech Republic, Government of",Governments,CZE,2025,2025,Escalation of Hostilities in the OPT Flash Appeal 2025,FPSE25,1273,Caritas Czech Republic,NGOs,Health,PSE,,,oPt Complex Emergency 2023-24,2025,2025,financial,Standard,Traditional aid,incoming,single,paid,2025-07-16,2025-03-05,,5000000,CZK,23.97,356070,CZE-25-HU-KSA-21,2025-07-29,2025-07-29
2025-07-26,,Provision of emergency and psychosocial support to vulnerable children and their caregivers in the Gaza Strip,208594,"Czech Republic, Government of",Governments,CZE,2025,2025,Escalation of Hostilities in the OPT Flash Appeal 2025,FPSE25,1273,People in Need,NGOs,Health,PSE,,,oPt Complex Emergency 2023-24,2025,2025,financial,Standard,Traditional aid,incoming,single,paid,2025-07-16,2025-03-05,,5000000,CZK,23.97,349613,CZE-25-HU-KSA-36,2025-07-26,2025-07-26
2025-07-25,,Procurement of Medical Equipment,212671,"Czech Republic, Government of",Governments,CZE,2025,2025,,,,Beit Jala Governmental Hospital,Governments,Health,PSE,,,,2025,2025,financial,Standard,Traditional aid,incoming,single,commitment,2025-07-16,2025-02-12,,5119000,CZK,24.07,349572,CZE-102047-5/2025-MZV/BVA,2025-07-25,2025-07-25
2025-07-25,2025,HAC-STATE OF PALESTINE	  Palestine: ECHO HAB flights March 2025	Special Purpose	Public Sector	Non-Thematic	Not multi-year,140760,European Commission's Humanitarian Aid and Civil Protection Department,Multilateral Organizations,,2025,2025,Escalation of Hostilities in the OPT Flash Appeal 2025,FPSE25,1273,United Nations Children's Fund,Multilateral Organizations,Logistics,PSE,,,oPt Complex Emergency 2023-24,2025,2025,in kind,Standard,Traditional aid,incoming,single,paid,2025-07-25,2025-05-01,,,,,349583,KM250014	KM250014140760,2025-07-25,2025-07-25
2025-07-25,2025,HAC-STATE OF PALESTINE	  Palestine: ECHO HAB flights March 2025	Special Purpose	Public Sector	Non-Thematic	Not multi-year,83412,European Commission's Humanitarian Aid and Civil Protection Department,Multilateral Organizations,,2025,2025,Escalation of Hostilities in the OPT Flash Appeal 2025,FPSE25,1273,United Nations Children's Fund,Multilateral Organizations,Logistics,PSE,,,oPt Complex Emergency 2023-24,2025,2025,in kind,Standard,Traditional aid,incoming,single,paid,2025-07-25,2025-06-20,,,,,349584,KM250024	KM25002483412,2025-07-25,2025-07-25
2025-07-24,2025,"HAC-STATE OF PALESTINE	Palestine: HAC Gaza, providing humanitarian aid to children and civilians.	Development funds for Humanitarian/Resilience response			Public Sector	Non-Thematic	Not multi-year",1135074,"Croatia, Government of",Governments,HRV,2025,2025,Escalation of Hostilities in the OPT Flash Appeal 2025,FPSE25,1273,United Nations Children's Fund,Multilateral Organizations,,PSE,,,oPt Complex Emergency 2023-24,2025,2025,financial,Standard,Traditional aid,incoming,single,paid,2025-07-24,2025-06-09,,1000000,EUR,0.881,349517,SM250242             SM2502421135074,2025-07-24,2025-07-24
2025-07-24,2025,HAC-STATE OF PALESTINE	Thematic Humanitarian Funds for Cross-Sectoral Activities-State ofPalestine-Gaza	Cross-Sectoral (two or more outcome areas)	THM HUMANITAR 2022-2025	Various Donors	Private Sector	Thematic	Not multi-year,43783,UNICEF National Committee/Luxembourg,Private Organizations,,2025,2025,Escalation of Hostilities in the OPT Flash Appeal 2025,FPSE25,1273,United Nations Children's Fund,Multilateral Organizations,,PSE,,,oPt Complex Emergency 2023-24,2025,2025,financial,Standard,Traditional aid,incoming,single,paid,2025-07-24,2025-05-27,,42246,EUR,0.9649,349525,SM2299300663	SM229930066387567,2025-07-24,2025-10-15
2025-07-24,2025,HAC-STATE OF PALESTINE	Emergency Health Support- State of Palestine-Gaza	Health		Cash Donors	Private Sector	Non-Thematic	Not multi-year,81725,UNICEF National Committee/Luxembourg,Private Organizations,,2025,2025,Escalation of Hostilities in the OPT Flash Appeal 2025,FPSE25,1273,United Nations Children's Fund,Multilateral Organizations,Health,PSE,,,oPt Complex Emergency 2023-24,2025,2025,financial,Standard,Traditional aid,incoming,single,paid,2025-07-24,2025-05-27,,72000,EUR,0.881,349526,SM250217	SM25021781725,2025-07-24,2025-07-24
2025-07-24,2025,HAC-STATE OF PALESTINE	    UNICEF’s 2025 Humanitarian Action for Children (HAC) in the State of Palestine.	Cross-Sectoral (two or more outcome areas)	Public Sector	Non-Thematic	Not multi-year,79455,"Malta, Government of",Governments,MLT,2025,2025,Escalation of Hostilities in the OPT Flash Appeal 2025,FPSE25,1273,United Nations Children's Fund,Multilateral Organizations,,PSE,,,oPt Complex Emergency 2023-24,2025,2025,financial,Standard,Traditional aid,incoming,single,paid,2025-07-24,2025-06-05,,70000,EUR,0.881,349530,SM250218	SM25021879455        NV-87/2025,2025-07-24,2025-07-24
2025-07-22,2025,United Kingdom Contribution to oPt Humanitarian Fund (3482) 2025,11486486,"United Kingdom, Government of",Governments,GBR,2025,2025,Escalation of Hostilities in the OPT Flash Appeal 2025,FPSE25,1273,Occupied Palestinian Territory Humanitarian Fund,Pooled Funds,,PSE,,,oPt Complex Emergency 2023-24,2025,2025,financial,Standard,Traditional aid,incoming,single,paid,2025-03-07,2025-02-19,,8500000,GBP,0.74,338829,OCT/GBR/2025/77513/OCHA(CBPF-OCHA)/PSE/84336 400022 amendment 6,2025-07-24,2025-07-28
2025-07-21,2025,Jersey (Jersey Overseas Aid) Contribution to OCHA 2025,33784,Jersey Overseas Aid,Governments,JEY,2025,2025,Escalation of Hostilities in the OPT Flash Appeal 2025,FPSE25,1273,Office for the Coordination of Humanitarian Affairs,Multilateral Organizations,Coordination and support services,PSE,,,oPt Complex Emergency 2023-24,2025,2025,financial,Standard,Traditional aid,incoming,single,paid,2025-07-12,2025-07-08,,25000,GBP,0.728,348790,OCT/JEY/2025/77688/OCHA(OCHA Program)/PSE/84727 N/A,2025-07-23,2025-07-28
2025-07-21,2025,Jersey Contribution to oPt Humanitarian Fund (3482) 2025,101351,Jersey Overseas Aid,Governments,JEY,2025,2025,Escalation of Hostilities in the OPT Flash Appeal 2025,FPSE25,1273,Occupied Palestinian Territory Humanitarian Fund,Pooled Funds,,PSE,,,oPt Complex Emergency 2023-24,2025,2025,financial,Standard,Traditional aid,incoming,single,paid,2025-07-12,2025-07-11,,75000,GBP,0.74,348791,OCT/JEY/2025/77688/OCHA(CBPF-OCHA)/PSE/84728 N/A,2025-07-23,2025-07-28
2025-07-21,,Procurement of Medical Equipment,84670,"Czech Republic, Government of",Governments,CZE,2025,2025,Escalation of Hostilities in the OPT Flash Appeal 2025,FPSE25,1273,Holy Family Hospital,Private Organizations,Health,PSE,,,oPt Complex Emergency 2023-24,2025,2025,financial,Standard,Traditional aid,incoming,single,commitment,2025-07-16,2025-02-12,,2038000,CZK,24.07,349293,CZE-102047-5/2025-MZV/BVA,2025-07-21,2025-07-21
2025-07-21,,Procurement of an ambulance car with a mobile clinic,269295,"Czech Republic, Government of",Governments,CZE,2025,2025,Escalation of Hostilities in the OPT Flash Appeal 2025,FPSE25,1273,Caritas Jerusalem,NGOs,Health,PSE,,,oPt Complex Emergency 2023-24,2025,2025,financial,Standard,Traditional aid,incoming,single,commitment,2025-07-16,2025-03-04,,6455000,CZK,23.97,349303,CZE-104910-5/2025-MZV/BVA,2025-07-21,2025-07-21
2025-07-18,,Food and nutrition assistance to the people of Gaza,202511,"Czech Republic, Government of",Governments,CZE,2025,2025,Escalation of Hostilities in the OPT Flash Appeal 2025,FPSE25,1273,World Food Programme,Multilateral Organizations,Nutrition,PSE,,,oPt Complex Emergency 2023-24,2025,2025,financial,Standard,Traditional aid,incoming,single,paid,2025-07-16,2025-01-27,,5000000,CZK,24.69,349202,CZE-101831-1/2025-MZV/ORS,2025-07-18,2025-07-18
2025-07-16,,"Critical Response to Sustain Livelihoods, Enhance Food Security, and Save the Lives of Conflict-Affected Populations in the Gaza Strip",0,European Commission's Humanitarian Aid and Civil Protection Department,Multilateral Organizations,,2025,2025,,,,Food and Agriculture Organization of the United Nations,Multilateral Organizations,Food Security,PSE,,,,2025,2026,financial,Parked,Traditional aid,incoming,shared,commitment,2025-07-16,2025-05-01,Multiyear,0,EUR,0.9545,348998,OSRO/GAZ/036/EC,2025-07-16,2025-07-16
2025-07-16,,"Critical Response to Sustain Livelihoods, Enhance Food Security, and Save the Lives of Conflict-Affected Populations in the Gaza Strip",1257242,European Commission's Humanitarian Aid and Civil Protection Department,Multilateral Organizations,,2025,2025,Escalation of Hostilities in the OPT Flash Appeal 2025,FPSE25,1273,Food and Agriculture Organization of the United Nations,Multilateral Organizations,Food Security,PSE,,,oPt Complex Emergency 2023-24,2025,2025,financial,Standard,Traditional aid,incoming,single,commitment,2025-07-16,2025-05-01,Multiyear,1200037,EUR,0.9545,348999,OSRO/GAZ/036/EC,2025-07-16,2025-07-16
2025-07-15,,KUWAIT RED CRESCENT - One-year hospital project for the care of the wounded and injured patients at a hospital in Cairo (first payment)- Gaza,100000,"Kuwait, Government of",Governments,KWT,2025,2025,,,,Palestine Red Crescent Society,Red Cross/Red Crescent Organizations,Health,PSE,,,,2025,2025,financial,Standard,Traditional aid,incoming,single,paid,2025-07-13,2025-05-14,,30885,KWD,0.3089,348858,,2025-07-15,2025-07-15
2025-07-15,2025,Food Security	Food security and nutrition,116959,"Slovenia, Government of",Governments,SVN,2025,2025,Escalation of Hostilities in the OPT Flash Appeal 2025,FPSE25,1273,United Nations Children's Fund,Multilateral Organizations,Food Security,PSE,,,oPt Complex Emergency 2023-24,2025,2025,financial,Standard,Traditional aid,incoming,single,commitment,2025-07-15,2025-07-03,,100000,EUR,0.854,348861,SM250313	N449/25,2025-10-15,2025-10-15
2025-07-15,2025,Food Security,468384,"Slovenia, Government of",Governments,SVN,2025,2025,Escalation of Hostilities in the OPT Flash Appeal 2025,FPSE25,1273,World Food Programme,Multilateral Organizations,Food Security,PSE,,,oPt Complex Emergency 2023-24,2025,2025,financial,Standard,Traditional aid,incoming,single,commitment,2025-07-15,2025-07-03,,400000,EUR,0.854,348865,51102-12/2025/3-7-1,2025-07-15,2025-07-15
2025-07-15,2025,Unearmarked	Multi-sector	Crisis response,1146789,"Slovenia, Government of",Governments,SVN,2025,2025,Escalation of Hostilities in the OPT Flash Appeal 2025,FPSE25,1273,United Nations Relief and Works Agency for Palestine Refugees in the Near East,Multilateral Organizations,,PSE,,,oPt Complex Emergency 2023-24,2025,2025,financial,Standard,Traditional aid,incoming,single,commitment,2025-07-15,2025-06-17,,1000000,EUR,0.872,348868,51105-5/2025/3-1,2025-07-15,2025-07-15
2025-07-14,2024,United States (USAID-BHA) Contribution to OCHA 2025,818000,"United States of America, Government of",Governments,USA,2025,2025,Escalation of Hostilities in the OPT Flash Appeal 2025,FPSE25,1273,Office for the Coordination of Humanitarian Affairs,Multilateral Organizations,Coordination and support services,PSE,,,oPt Complex Emergency 2023-24,2025,2025,financial,Standard,Traditional aid,incoming,single,paid,2025-06-05,2024-10-29,,,,,345851,OCT/USA/2025/77522/OCHA(OCHA Program)/PSE/84350 720BHA25IO00043,2025-07-16,2025-07-16
2025-07-11,2025,"Palestine, State of - Thematic Cross Sectoral - State of Palestine	Cross-Sectoral (two or more outcome areas)",182353,United States Fund for UNICEF,Private Organizations,,2025,2025,Escalation of Hostilities in the OPT Flash Appeal 2025,FPSE25,1273,United Nations Children's Fund,Multilateral Organizations,,PSE,,,oPt Complex Emergency 2023-24,2025,2025,financial,Pass through,Traditional aid,incoming,single,paid,2025-07-08,2025-05-01,,,,,343670,SM2299300649,2025-10-13,2025-10-13
2025-07-11,2025,Iceland Contribution to oPt Humanitarian Fund (3482) 2025,492418,"Iceland, Government of",Governments,ISL,2025,2025,Escalation of Hostilities in the OPT Flash Appeal 2025,FPSE25,1273,Occupied Palestinian Territory Humanitarian Fund,Pooled Funds,,PSE,,,oPt Complex Emergency 2023-24,2025,2025,financial,Standard,Traditional aid,incoming,single,paid,2025-07-04,2025-07-03,,60000000,ISK,121.8477,348303,OCT/ISL/2025/77683/OCHA(CBPF-OCHA)/PSE/84722 UTN25060275,2025-07-18,2025-07-18
2025-07-11,2025,Thematic Cross Sectoral Response SoP	Cross-Sectoral (two or more outcome areas),4167043,UNICEF National Committee/Ireland,Private Organizations,IRL,2025,2025,Escalation of Hostilities in the OPT Flash Appeal 2025,FPSE25,1273,United Nations Children's Fund,Multilateral Organizations,,PSE,,,oPt Complex Emergency 2023-24,2025,2025,financial,Standard,Traditional aid,incoming,single,paid,2025-07-08,2025-06-06,,,,,348728,SM2299300593,2025-07-11,2025-10-15
2025-07-11,2025,Flexport donation of freight of RUIF to SoP,550000,United States Fund for UNICEF,Private Organizations,,2025,2025,Escalation of Hostilities in the OPT Flash Appeal 2025,FPSE25,1273,United Nations Children's Fund,Multilateral Organizations,,PSE,,,oPt Complex Emergency 2023-24,2025,2025,in kind,Standard,Traditional aid,incoming,single,paid,2025-07-08,2025-06-03,,,,,348731,KM250019,2025-07-11,2025-07-11
2025-07-11,2025,Gaza Nutrition Support	Nutrition,3229974,"Australia, Government of",Governments,AUS,2025,2025,Escalation of Hostilities in the OPT Flash Appeal 2025,FPSE25,1273,United Nations Children's Fund,Multilateral Organizations,Nutrition,PSE,,,oPt Complex Emergency 2023-24,2025,2025,financial,Standard,Traditional aid,incoming,single,paid,2025-07-08,2025-06-11,,5000000,AUD,1.548,348752,SM250246	77336/44,2025-07-11,2025-10-21
2025-07-11,,Provision of humanitarian and resilient WASH,10000000,"Korea, Republic of, Government of",Governments,KOR,2025,2025,Escalation of Hostilities in the OPT Flash Appeal 2025,FPSE25,1273,United Nations Children's Fund,Multilateral Organizations,Water Sanitation Hygiene,PSE,,,oPt Complex Emergency 2023-24,2025,2025,financial,Standard,Traditional aid,incoming,single,paid,2025-07-08,2025-06-01,,,,,348763,SM250223,2025-07-11,2025-07-11
2025-07-11,,2022-2025 Humanitarian Action Thematic Pool - State of Palestine,3943952,UNICEF National Committee/United Kingdom,Private Organizations,,2025,2025,Escalation of Hostilities in the OPT Flash Appeal 2025,FPSE25,1273,United Nations Children's Fund,Multilateral Organizations,,PSE,,,oPt Complex Emergency 2023-24,2025,2025,financial,Standard,Traditional aid,incoming,single,paid,2025-07-08,2025-06-17,,,,,348764,SM2299300397,2025-07-11,2025-10-15
2025-07-11,,Thematic Cross Sectoral - GAZA,262578,UNICEF National Committee/Austria,Private Organizations,,2025,2025,Escalation of Hostilities in the OPT Flash Appeal 2025,FPSE25,1273,United Nations Children's Fund,Multilateral Organizations,,PSE,,,oPt Complex Emergency 2023-24,2025,2025,financial,Standard,Traditional aid,incoming,single,paid,2025-07-08,2025-05-07,,,,,348765,SM2299300612,2025-07-11,2025-10-15
2025-07-11,,Thematic Cross Sectoral - SOP,69316,UNICEF National Committee/New Zealand,Private Organizations,,2025,2025,Escalation of Hostilities in the OPT Flash Appeal 2025,FPSE25,1273,United Nations Children's Fund,Multilateral Organizations,,PSE,,,oPt Complex Emergency 2023-24,2025,2025,financial,Standard,Traditional aid,incoming,single,paid,2025-07-08,2025-05-07,,,,,348766,SM2299300461,2025-07-11,2025-07-11
2025-07-11,,"UNICEF-Argentina
Thematic Humanitarian Funds for Cross Sectoral Activities in SoP",47397,UNICEF National Committees,Private Organizations,,2025,2025,Escalation of Hostilities in the OPT Flash Appeal 2025,FPSE25,1273,United Nations Children's Fund,Multilateral Organizations,,PSE,,,oPt Complex Emergency 2023-24,2025,2025,financial,Standard,Traditional aid,incoming,single,paid,2025-07-08,2025-05-31,,,,,348767,SM2299300539,2025-07-11,2025-10-15
2025-07-11,,"UNICEF-Kuwait
Thematic Humanitarian Funds for Cross-Sectoral Activities - Online don. - SOP",40561,UNICEF National Committees,Private Organizations,,2025,2025,Escalation of Hostilities in the OPT Flash Appeal 2025,FPSE25,1273,United Nations Children's Fund,Multilateral Organizations,,PSE,,,oPt Complex Emergency 2023-24,2025,2025,financial,Standard,Traditional aid,incoming,single,paid,2025-07-08,2025-05-01,,,,,348768,SM2299300517,2025-07-11,2025-10-15
2025-07-11,,"UNICEF-BAHRAIN
Thematic Humanitarian Funds for Cross-Sectoral Activities - Online don. - SOP",19520,UNICEF National Committees,Private Organizations,,2025,2025,Escalation of Hostilities in the OPT Flash Appeal 2025,FPSE25,1273,United Nations Children's Fund,Multilateral Organizations,,PSE,,,oPt Complex Emergency 2023-24,2025,2025,financial,Standard,Traditional aid,incoming,single,paid,2025-07-08,2025-05-01,,,,,348770,SM2299300518,2025-07-11,2025-10-15
2025-07-11,,"UNICEF-Egypt
Thematic Humanitarian Funds for Cross-Sectoral Activities - Online don. - SOP",22495,UNICEF National Committees,Private Organizations,,2025,2025,Escalation of Hostilities in the OPT Flash Appeal 2025,FPSE25,1273,United Nations Children's Fund,Multilateral Organizations,,PSE,,,oPt Complex Emergency 2023-24,2025,2025,financial,Standard,Traditional aid,incoming,single,paid,2025-07-08,2025-05-01,,,,,348773,SM2299300400,2025-07-11,2025-10-15
2025-07-11,,"UNICEF-QATAR
Thematic Humanitarian Funds for Cross-Sectoral Activities - Online don. - SOP",18965,UNICEF National Committees,Private Organizations,,2025,2025,Escalation of Hostilities in the OPT Flash Appeal 2025,FPSE25,1273,United Nations Children's Fund,Multilateral Organizations,,PSE,,,oPt Complex Emergency 2023-24,2025,2025,financial,Standard,Traditional aid,incoming,single,paid,2025-07-08,2025-05-01,,,,,348774,SM2299300519,2025-07-11,2025-10-15
